{"config_domain":"risk.rules","candidate_version":"v2","candidate_checksum":"aaaaaaaaaaaaaaaaaaaaaaaaaaaaaaaaaaaaaaaaaaaaaaaaaaaaaaaaaaaaaaaa","previous_version":"v1","active_version":"v2","active_checksum":"aaaaaaaaaaaaaaaaaaaaaaaaaaaaaaaaaaaaaaaaaaaaaaaaaaaaaaaaaaaaaaaa","activation_mode":"HOT_RELOAD","safe_boundary":"NEXT_ORDER_BOUNDARY","required_components":["RiskEngine"],"component_acks":{"RiskEngine":{"component_id":"RiskEngine","candidate_version":"v2","candidate_checksum":"aaaaaaaaaaaaaaaaaaaaaaaaaaaaaaaaaaaaaaaaaaaaaaaaaaaaaaaaaaaaaaaa","generation":1,"capability_version":"risk-v1","result":"APPLIED","activation_mode":"HOT_RELOAD","safe_boundary":"NEXT_ORDER_BOUNDARY","observed_at":"2026-08-11T01:00:00Z","ack_sequence":1}},"secret_references":["secret://risk/api"],"policy_version":"policy-v1","policy_checksum":"bbbbbbbbbbbbbbbbbbbbbbbbbbbbbbbbbbbbbbbbbbbbbbbbbbbbbbbbbbbbbbbb","activated_at":"2026-08-11T01:00:00Z","activation_sequence":10}
