{"config_domain":"market.gateway","candidate_version":"v3","candidate_checksum":"cccccccccccccccccccccccccccccccccccccccccccccccccccccccccccccccc","previous_version":null,"active_version":"v3","active_checksum":"cccccccccccccccccccccccccccccccccccccccccccccccccccccccccccccccc","activation_mode":"RESTART_REQUIRED","safe_boundary":"RESTART_ONLY","required_components":["MarketGateway"],"component_acks":{"MarketGateway":{"component_id":"MarketGateway","candidate_version":"v3","candidate_checksum":"cccccccccccccccccccccccccccccccccccccccccccccccccccccccccccccccc","generation":2,"capability_version":"gateway-v2","result":"APPLIED","activation_mode":"RESTART_REQUIRED","safe_boundary":"RESTART_ONLY","observed_at":"2026-08-11T01:00:00Z","ack_sequence":1}},"secret_references":[],"policy_version":"policy-v2","policy_checksum":"dddddddddddddddddddddddddddddddddddddddddddddddddddddddddddddddd","activated_at":"2026-08-11T01:00:00Z","activation_sequence":11}
